{
  "version": 1,
  "plans": [
    "guest",
    "free",
    "plus",
    "pro"
  ],
  "guest_skill_ids": [
    "core",
    "proactive-agent"
  ],
  "limits": {
    "guest": {
      "search_depth": "basic",
      "concurrent_runs": 1,
      "daily_tokens": 20000,
      "user_skill_uploads": 0
    },
    "free": {
      "search_depth": "standard",
      "concurrent_runs": 1,
      "daily_tokens": 80000,
      "user_skill_uploads": 2
    },
    "plus": {
      "search_depth": "deep",
      "concurrent_runs": 2,
      "daily_tokens": 300000,
      "user_skill_uploads": 10
    },
    "pro": {
      "search_depth": "deep",
      "concurrent_runs": 4,
      "daily_tokens": 1000000,
      "user_skill_uploads": 50
    }
  },
  "payment_available": false
}
